{
  "schema_version": 1,
  "tenant_id": "tenant_local",
  "environment_id": "env_local",
  "verification_id": "verification_example",
  "route_id": "route_generic-json",
  "source_contract_sha256": "sha256:aaaaaaaaaaaaaaaaaaaaaaaaaaaaaaaaaaaaaaaaaaaaaaaaaaaaaaaaaaaaaaaa",
  "target_contract_sha256": "sha256:aaaaaaaaaaaaaaaaaaaaaaaaaaaaaaaaaaaaaaaaaaaaaaaaaaaaaaaaaaaaaaaa",
  "dsl_sha256": "sha256:aaaaaaaaaaaaaaaaaaaaaaaaaaaaaaaaaaaaaaaaaaaaaaaaaaaaaaaaaaaaaaaa",
  "artifact_sha256": "sha256:aaaaaaaaaaaaaaaaaaaaaaaaaaaaaaaaaaaaaaaaaaaaaaaaaaaaaaaaaaaaaaaa",
  "policy_sha256": "sha256:aaaaaaaaaaaaaaaaaaaaaaaaaaaaaaaaaaaaaaaaaaaaaaaaaaaaaaaaaaaaaaaa",
  "corpus_sha256": "sha256:aaaaaaaaaaaaaaaaaaaaaaaaaaaaaaaaaaaaaaaaaaaaaaaaaaaaaaaaaaaaaaaa",
  "runtime_version": "not-implemented-week-1",
  "abi_version": 1,
  "created_at": "2026-10-18T00:00:00Z",
  "expires_at": "2026-10-19T00:00:00Z",
  "result": "incomplete",
  "corpus_origin": "synthetic",
  "distinct_cases": 4,
  "holdout_cases": 0,
  "coverage_gaps": [
    "No real events or independent holdout; no Wasm execution."
  ],
  "signer_key_id": "example_unsigned",
  "signature_ref": "example:unsigned-do-not-deploy"
}
